"id","meta_title","url","meta_description","product_description","key_features","specifications"
"7442450546877","Albetta Crochet Peanut the Puppy Babygro Romper | Soft Organic Cotton | Baby Blue & White Stripe","https://maisonsunny.com.au/products/crochet-peanut-the-puppy-babygro-romper","Adorable hand-crocheted puppy motif babygro by Albetta. Made from premium soft organic cotton in a baby blue marl and snow white stripe. Perfect for autumn-winter.","The Albetta Crochet Peanut the Puppy Babygro is a charming addition to any baby's wardrobe. This adorable romper features a beautifully hand-crocheted puppy motif, adding a touch of whimsy to this cozy essential. Crafted from premium soft baby blue marl and snow white striped 100% organic cotton, it ensures gentle comfort against delicate skin. Grey marl trims line the neck and cuffs, providing a subtle contrast and a signature Albetta detail. This babygro is perfect for keeping little ones warm and stylish during the autumn-winter months. Machine washable at 30°C for easy care.","[""Hand-Crocheted Puppy Motif: This babygro features an adorable hand-crocheted puppy design, adding a unique and charming touch to your baby's outfit."",""Premium Soft Organic Cotton: Made from 100% organic cotton, this babygro is exceptionally soft and gentle against your baby's delicate skin, ensuring maximum comfort."",""Baby Blue and White Stripe Design: The classic baby blue marl and snow white stripe pattern creates a timeless and stylish look, perfect for everyday wear."",""Grey Marl Trim Detail: The neck and cuffs are lined with grey marl trims, adding a touch of subtle contrast and a signature Albetta design element."",""Easy Care: Machine washable at 30°C, this babygro is easy to care for, making it a practical choice for busy parents.""]","{""Brand"":""Albetta"",""Material"":""100% Organic Cotton"",""Care Instructions"":""Machine washable at 30°C"",""Color"":""Baby Blue Marl and Snow White Stripe"",""Pattern"":""Striped with Hand-Crocheted Puppy Motif"",""Sizes"":""0-3 months, 3-6 months, 6-12 months"",""Item Weight"":""N/A"",""Product Dimensions"":""N/A""}"
"7442449334461","Albetta Crochet Rainbow Babygrow | Soft Cotton Romper | 0-3 Months","https://maisonsunny.com.au/products/crochet-rainbow-blue-marl-stripe-babygro-romper","Adorable blue and white striped cotton babygrow with sparkly copper thread and a crocheted rainbow motif. Features gold poppers and pink picot trim. Machine washable.","This charming Albetta Crochet Rainbow Babygrow is a delightful addition to any baby's wardrobe. Crafted from the softest baby blue and white striped 100% organic cotton, this romper features a beautifully crocheted rainbow motif with sparkly copper thread accents.  Intricate details like gold poppers and pink picot trim around the neck and cuffs add a touch of elegance. This babygrow is not only adorable but also practical, designed for ultimate comfort and easy care. Machine washable at 30°C. Perfect for everyday wear or special occasions, this babygrow makes a wonderful gift for newborns and infants. Coordinate it with the matching Rainbow Crochet Ring Rattle (sold separately) for a complete ensemble.","[""SOFT & SPARKLY: Made from incredibly soft, baby blue and white striped 100% organic cotton with shimmering copper thread accents for a touch of magic."",""ADORABLE RAINBOW DESIGN: Features a charming crocheted rainbow motif, adding a playful and cheerful element to this comfortable romper."",""ELEGANT DETAILS: Gold poppers and delicate pink picot trim around the neck and cuffs provide sophisticated finishing touches."",""PREMIUM QUALITY: Crafted with meticulous attention to detail, ensuring durability and long-lasting wear."",""EASY CARE: Machine washable at 30°C for convenient cleaning, making it perfect for busy parents.""]","{""brand"":""Albetta"",""material"":""100% Organic Cotton"",""color"":""Blue and White Stripe"",""size"":""0-3 Months"",""care_instructions"":""Machine washable at 30°C"",""department"":""Baby"",""product_type"":""Romper, Babygrow"",""style"":""Crochet, Rainbow"",""target_audience"":""Newborns, Infants"",""occasion"":""Everyday, Special Occasion"",""weight"":""N/A"",""dimensions"":""N/A""}"
"7442455593149","Albetta Crochet Rainbow Ring Rattle | Baby Sensory Toy | FSC Mango Wood | 14cm Tall","https://maisonsunny.com.au/products/crochet-rainbow-ring-rattle","Stimulate your baby's senses with the Albetta Crochet Rainbow Ring Rattle. Crafted from FSC-certified mango wood and soft, crocheted cotton, this rattle is perfect for little hands. Features sparkly copper thread details and a 14cm height. Ideal for newborns and infants.","Introduce your little one to the enchanting world of sensory play with the Albetta Crochet Rainbow Ring Rattle. This beautifully crafted rattle combines the natural warmth of FSC-certified mango wood with the soft touch of hand-crocheted 100% cotton. The vibrant rainbow design, adorned with delicate sparkly copper thread details, captivates baby's attention and encourages visual exploration.  The easy-grip ring is perfectly sized for small hands to grasp, shake, and explore, helping to develop fine motor skills and hand-eye coordination. The gentle rattling sound stimulates auditory senses and provides soothing comfort. This rattle is not only a delightful toy but also a testament to Albetta's commitment to quality and sustainability. Made with eco-friendly materials and designed with baby's safety in mind, the Albetta Crochet Rainbow Ring Rattle is a cherished gift for newborns and infants. Pair it with the matching Rainbow Babygro Suit for a complete coordinated look.","[""Sensory Delight: Stimulate your baby's visual and auditory senses with the vibrant rainbow design and gentle rattling sound."",""Easy-Grip Design: The 14cm tall FSC mango wood ring is perfectly sized for little hands to grasp and shake, promoting fine motor skill development."",""Hand-Crocheted Quality: Made with 100% soft cotton and adorned with sparkly copper thread details for a touch of magic."",""Eco-Friendly Materials: Crafted from sustainably sourced FSC-certified mango wood, ensuring a safe and environmentally conscious choice for your baby."",""Perfect Baby Gift: A thoughtful and charming present for newborns and infants, ideal for baby showers, birthdays, or any special occasion.""]","{""Brand"":""Albetta"",""Material"":""100% Cotton, FSC Mango Wood, Polyester Stuffing"",""Height"":""14 cm"",""Item Weight"":""N/A"",""Item Dimensions"":""N/A"",""Color"":""Rainbow""}"
"7442448548029","Albetta Crochet Rocket Babygro Romper | 100% Organic Cotton | Baby Jumpsuit","https://maisonsunny.com.au/products/crochet-rocket-babygro-romper","Out-of-this-world Albetta Crochet Rocket Babygro Romper made with 100% organic textured jersey cotton. Features a hand-crochet rocket motif. Perfect for little astronauts!","The Albetta Crochet Rocket Babygro Romper is part of the exciting Albetta space collection. This fun and unique babygro is crafted from the softest 100% organic textured jersey cotton, ensuring gentle comfort against delicate skin. The romper features a vibrant hand-crochet rocket motif, adding a playful touch of color and whimsy. The bold colors and Albetta's signature attention to detail make this babygro an ideal choice for any adventurous little one. This romper is perfect for everyday wear, playtime, or special occasions. It makes a wonderful gift for baby showers, birthdays, or any celebratory event. Give the gift of comfort and style with the Albetta Crochet Rocket Babygro Romper. Machine washable at 30°C for easy care. Matching rattle and cuddle toys are also available (sold separately).","[""Crafted from 100% organic textured jersey cotton for ultimate softness and comfort."",""Features a brightly colored, hand-crochet rocket motif, adding a playful and unique touch."",""Designed with bold colors and Albetta's iconic attention to detail, making it a standout piece."",""Perfect for everyday wear, playtime, or special occasions, ensuring your little one is always stylish."",""Machine washable at 30°C for easy and convenient care, making it a practical choice for busy parents.""]","{""Brand"":""Albetta"",""Material"":""100% Organic Cotton"",""Care Instructions"":""Machine washable at 30°C"",""Sizes"":""0-3 m, 3-6 m, 6-12 m"",""Weight"":""N/A"",""Dimensions"":""N/A""}"
"7442455527613","Albetta Crochet Rocket Ring Rattle | Baby Teether and Rattle | Fun and Engaging ","https://maisonsunny.com.au/products/crochet-rocket-ring-rattle","Stimulate your baby's senses with the Albetta Crochet Rocket Ring Rattle. Made with FSC mango wood and featuring a 3D crochet flame, this teether is safe, engaging, and visually appealing.","Introduce your little one to the wonders of space with the Albetta Crochet Rocket Ring Rattle! This adorable teething toy is part of the brand-new Albetta space collection, designed to engage and entertain babies from birth. Crafted with fun, bold colors and intricate crochet details, this rattle features a captivating 3D crochet flame that can be moved around the ring, adding an element of playful discovery. 

Made from high-quality FSC-certified mango wood, the smooth ring provides a soothing surface for teething gums, while the soft hand-crochet rocket offers a comforting tactile experience. The rattle's vibrant colors and unique design stimulate visual development, and the gentle rattling sound encourages auditory exploration. 

Safety is our top priority. This rattle has been rigorously CE/UK tested and is safe for babies from birth. It's the perfect gift for newborns, baby showers, or any occasion celebrating a little space explorer. 

Dimensions: Height 15cm. Material: FSC Mango Wood and Crochet.  Bring a smile to your baby's face with the Albetta Crochet Rocket Ring Rattle – a delightful combination of fun, function, and intergalactic charm!","[""Engaging Baby Rattle: This crochet rocket ring rattle stimulates baby's senses with vibrant colors, textures, and gentle sounds, promoting healthy development and providing endless entertainment."",""Safe and Natural Teether: Made from high-quality FSC-certified mango wood, the smooth ring is perfect for soothing sore gums during teething, while the soft crochet rocket offers a comforting tactile experience."",""Unique 3D Crochet Flame: The movable 3D crochet flame adds an element of playful discovery and encourages interaction, keeping baby engaged and entertained."",""Space-Themed Design: Part of the Albetta space collection, this adorable rocket rattle sparks imagination and adds a touch of intergalactic charm to baby's playtime."",""Safe From Birth: Rigorously CE/UK tested, this rattle is safe for babies from birth, making it a perfect gift for newborns, baby showers, or any occasion celebrating a little one.""]","{""Brand"":""Albetta"",""Material"":""FSC Mango Wood, Crochet"",""Height"":""15 cm"",""Item Weight"":""N/A"",""Product Dimensions"":""N/A"",""Color"":""Multicolor"",""Unit Count"":""1"",""Unit Count Type"":""Count"",""Target Audience"":""Babies"",""backend_keywords"":""baby rattle, teether, crochet toy, sensory toy, baby gift, newborn gift, space toy, rocket toy, wood teether, safe from birth, Albetta rattle""}"
"7442448154813","Albetta Crochet Wild Animals Babygro Romper | Organic Cotton | 0-3 Months","https://maisonsunny.com.au/products/crochet-wild-animals-babygro-romper","Adorable Albetta Wild Animals Babygro Romper in deep ocean blue striped organic cotton. Features hand-crocheted lion, elephant, and giraffe faces. Perfect for autumn-winter.","The Albetta Crochet Wild Animals Babygro Romper is a charming addition to any baby's wardrobe. Crafted from 100% organic cotton, this romper is gentle on delicate skin while offering exceptional comfort. The deep ocean blue striped design is accented with intricately hand-crocheted wild animal faces, including a lion, elephant, and giraffe, adding a touch of whimsy to this adorable outfit. Grey marl trims at the neck and cuffs provide a stylish finishing touch. This babygro is perfect for the autumn-winter season and makes a thoughtful gift for newborns and infants. Machine washable at 30°C for easy care.","[""Hand-Crocheted Animal Faces: Features intricately hand-crocheted lion, elephant, and giraffe faces, adding a playful touch to this adorable babygro."",""100% Organic Cotton: Made from the softest, ethically sourced 100% organic cotton, ensuring gentle comfort for your little one's delicate skin."",""Deep Ocean Blue Stripes: Designed in a stylish deep ocean blue striped pattern, perfect for both baby boys and girls."",""Autumn-Winter Essential: Ideal for keeping your baby cozy and warm during the cooler months, this romper is a must-have for any autumn-winter wardrobe."",""Easy Care: Machine washable at 30°C for convenient cleaning and maintenance.""]","{""brand"":""Albetta"",""material"":""100% Organic Cotton"",""care_instructions"":""Machine washable at 30°C"",""size"":""0-3 m"",""color"":""Deep Ocean Blue Striped"",""weight"":""N/A"",""dimensions"":""N/A""}"
"7442450612413","Albetta Rocket Cuddle Toy | Soft Organic Muslin Cotton | Baby Comfort Toy","https://maisonsunny.com.au/products/rocket-cuddle-toy","Soothe your little one with the Albetta Rocket Cuddle Toy. Crafted from soft organic muslin cotton, this hand-crocheted rocket is perfect for bedtime cuddles and playtime. CE/UK tested, safe from birth.","The Albetta Rocket Cuddle Toy is the perfect cuddly companion for your little one. Made from a blend of soft toweling and printed cotton, this adorable rocket features a hand-crocheted design crafted from the softest organic muslin cotton. Measuring 35cm in height, it's the ideal size for little hands to grasp and play with. This charming toy is sure to become a cherished friend, providing comfort and entertainment for babies and toddlers alike.

Designed to match the Albetta Space Babygro (sold separately), this rocket cuddle toy adds a touch of whimsy to any nursery. Its gentle textures and playful design stimulate the senses and encourage imaginative play. Whether it's a bedtime cuddle buddy or a playtime pal, the Albetta Rocket Cuddle Toy is a delightful addition to your child's world.

Made with 100% organic muslin cotton, this toy is not only soft and snuggly but also gentle on delicate skin. It has been rigorously CE/UK tested and is safe for babies from birth. Give your little astronaut the gift of comfort and adventure with the Albetta Rocket Cuddle Toy.","[""Soft and Cuddly Companion: Crafted from a combination of soft toweling, printed cotton, and hand-crocheted organic muslin cotton, this rocket cuddle toy provides ultimate comfort for your little one."",""Perfect for Little Hands: Measuring 35cm in height, this toy is perfectly sized for small hands to grasp, hold, and play with, promoting sensory development and fine motor skills."",""Safe from Birth: Rigorously CE/UK tested, this toy is made with 100% organic muslin cotton, ensuring it's gentle on delicate skin and safe for newborns and up."",""Bedtime and Playtime Friend: This versatile toy is perfect for both bedtime cuddles and playtime adventures, providing comfort and entertainment throughout the day."",""Matching Space Babygro Available: Complete the look with the coordinating Albetta Space Babygro (sold separately) for a fun and stylish addition to your baby's wardrobe.""]","{""Brand"":""Albetta"",""Material"":""100% Organic Muslin Cotton"",""Height"":""35cm"",""Safety Certification"":""CE/UK tested""}"
"7442450776253","Albetta Samuel Towelling Cuddle | Organic Cotton Sloth Toy | 35cm | Soft & Cuddly","https://maisonsunny.com.au/products/samuel-towelling-cuddle","The Albetta Samuel Towelling Cuddle is a handmade, organic cotton sloth toy, perfect for late-night cuddles. This adorable 35cm sloth is made with soft oak brown towelling and features rosy cheeks and dark brown eyes. CE/UK tested, safe from birth.","Introduce your little one to Samuel the Sloth, the newest addition to the Towelling Cuddle Toys collection! This adorable sloth is handmade with the softest oak brown organic cotton towelling, making him the perfect companion for cuddles. Samuel features rosy cheeks and endearing dark brown eyes, adding to his charm. Measuring 35cm in height, he's the perfect size for little arms to hold. This cuddly sloth is not only adorable but also safe, having been CE/UK tested and approved for use from birth. Pair Samuel with our Samuel the Sloth Babygro collection for a perfectly coordinated look. Made with 100% organic cotton towelling, this toy is gentle on delicate skin and provides a comforting tactile experience. Give the gift of snuggles with Samuel the Sloth, a cuddly friend that will be cherished for years to come.","[""Handmade with love: Each Samuel the Sloth is carefully crafted by hand, ensuring exceptional quality and attention to detail."",""Ultra-soft organic cotton: Made with 100% organic cotton towelling, Samuel is incredibly soft and gentle against baby's skin, providing a soothing tactile experience."",""Perfect size for cuddling: Measuring 35cm tall, Samuel is the ideal size for little ones to hug and hold close, offering comfort and companionship."",""Safe from birth: CE/UK tested and approved, Samuel is safe for newborns and up, making him a perfect gift for baby showers or new arrivals."",""Adorable design: With his charming rosy cheeks, endearing dark brown eyes, and oak brown towelling fur, Samuel the Sloth is sure to capture hearts and become a cherished friend.""]","{""Brand"":""Albetta"",""Material"":""100% Organic Cotton Towelling"",""Height"":""35 cm"",""Safety Certification"":""CE/UK Tested""}"
"7442455789757","Albetta Wild Animals Activity Ring Rattle | Baby Sensory Toy | 12cm Tall","https://maisonsunny.com.au/products/wild-animals-activity-ring-rattle","Stimulate your baby's senses with the Albetta Wild Animals Activity Ring Rattle.  Hand-crafted with soft, tactile materials, this rattle features a giraffe and elephant and is designed to engage hearing and touch. Made with sustainably sourced FSC mango wood. Safe from birth.","The Albetta Wild Animals Activity Ring Rattle is a delightful addition to any baby's toy collection. This charming rattle features two adorable wild animals, Gerald the Giraffe and Estelle the Elephant, designed to captivate your little one's attention and encourage sensory exploration. Gerald is a beautifully hand-crocheted cotton rattle, while Estelle is hand-made from organic cotton toweling. Both characters are incredibly soft and tactile, making them perfect for little hands to grasp and explore.

This activity rattle is not only visually appealing but also designed to stimulate your baby's developing senses. The gentle rattling sound engages their hearing, while the varied textures of the giraffe and elephant promote tactile development. The ring is easy for small hands to hold, encouraging grasping and coordination skills.

Crafted from sustainably sourced FSC mango wood, this rattle is not only a beautiful toy but also an environmentally conscious choice. The wood provides a natural and durable base for the attached animals, ensuring long-lasting play.  This rattle is CE/UK tested and safe from birth, giving you peace of mind while your little one enjoys their new favorite toy.

Enhance your baby's playtime and development with the Albetta Wild Animals Activity Ring Rattle. It's the perfect gift for newborns and infants, offering a combination of engaging play, sensory stimulation, and sustainable design.","[""Sensory Stimulation: Engage your baby's hearing and sense of touch with the gentle rattling sound and soft, tactile materials of Gerald the Giraffe and Estelle the Elephant."",""Hand-Crafted Quality: Each wild animal is lovingly hand-crafted, with Gerald crocheted from cotton and Estelle made from organic cotton toweling, ensuring exceptional softness and durability."",""Sustainable Design: The rattle ring is made from sustainably sourced FSC mango wood, making it an environmentally friendly choice for your baby's toy collection."",""Safe for Babies: CE/UK tested and safe from birth, this rattle is designed with your baby's well-being in mind, allowing them to explore and play with confidence."",""Developmental Benefits: Encourages grasping, coordination, and sensory exploration, contributing to your baby's early development in a fun and engaging way.""]","{""Brand"":""Albetta"",""Material"":""Cotton, Organic Cotton Toweling, FSC Mango Wood"",""Height"":""12 cm"",""Safety Certification"":""CE/UK Certified"",""Item Weight"":""N/A"",""Item Dimensions LxWxH"":""N/A"",""Unit Count"":""1"",""Unit Count Type"":""Count"",""Batteries Required?"":""No"",""Number of Pieces"":""1""}"
"7840218153149","Maison Sunny Alex Blue Short Sleeved PJ Set for Kids (Sizes 2-10)","https://maisonsunny.com.au/products/alex-blue-short-sleeved-pj-pyjama-set","Shop the Maison Sunny Alex Blue Short Sleeved PJ Set. Made with a premium cotton/linen blend, this pyjama set features colored piping, coconut shell buttons, and an elastic waistband. Perfect for warm nights! Available in sizes 2-10.","The Maison Sunny Alex Blue Short Sleeved PJ Set is the perfect sleepwear for warm nights. Made from a premium cotton/linen blend, these pyjamas are soft, breathable, and comfortable. The set features stylish colored piping, natural coconut shell buttons, convenient front pockets, and an elastic waistband for a perfect fit. This PJ set is ideal for bedtime and lounging around the house. Available in sizes 2-10.

This collection is made with sustainably sourced excess fabric, giving new life to high-quality materials. The matching top and shorts create a classic look that kids will love. Give your child the gift of sweet dreams and comfortable nights with the Maison Sunny Alex Blue Short Sleeved PJ Set.","[""Premium Comfort: Made with a high-quality cotton/linen blend for a soft and breathable feel, perfect for warm nights."",""Stylish Details: Features colored piping and natural coconut shell buttons for a touch of elegance."",""Practical Design: Includes convenient front pockets and an elastic waistband for a comfortable and secure fit."",""Sustainably Made: Crafted from excess fabric, contributing to a more sustainable fashion choice."",""Perfect for Gifting: A thoughtful and practical gift for birthdays, holidays, or any special occasion.""]","{""Brand"":""Maison Sunny"",""Material"":""Cotton/Linen Blend"",""Sizes"":""2-10"",""Closure Type"":""Coconut Shell Buttons, Elastic Waistband"",""Care Instructions"":""Machine Wash 30 Degrees or Less"",""Style"":""Short Sleeved PJ Set"",""Colour"":""Blue"",""Item Weight"":""N/A"",""Item Dimensions"":""N/A""}"
"7837862789309","Maison Sunny Amelia Floral Fun Cotton Baby Romper Dress","https://maisonsunny.com.au/products/amelia-floral-fun-cotton-romper-dress","Adorable floral cotton romper dress for babies. Soft, breathable, and perfect for warm weather. Available in sizes 0-3m, 6-12m, 12-18m, and 18-24m.","Brighten up your little one's wardrobe with the Maison Sunny Amelia Romper. This charming romper dress combines style and comfort with a flared skirt layered over a romper, featuring a round neckline and short sleeves. Crafted from soft, breathable 100% cotton, it ensures comfort for your baby's delicate skin, making it ideal for warm weather adventures and playtime fun. The Amelia Romper allows unrestricted movement, perfect for crawling, playing, and exploring. Whether it's a day at the park or a family gathering, this romper adds a touch of color and charm to any occasion. Available in sizes 0-3m, 6-12m, 12-18m, and 18-24m. Please refer to the size chart image for detailed measurements.","[""Soft & Breathable: Made from 100% cotton, this romper dress provides ultimate comfort and breathability for your baby's delicate skin, perfect for warm weather."",""Playful Design: The flared skirt layered over the romper adds a touch of charm and allows for unrestricted movement during playtime."",""Stylish Floral Print: The vibrant floral print adds a pop of color and style to your baby's wardrobe, making it perfect for any occasion."",""Durable & Easy Care: The high-quality cotton fabric is durable and easy to care for, ensuring long-lasting wear."",""Perfect for All Occasions: Whether it's a casual day out or a special event, the Amelia Romper is a versatile choice that will keep your baby looking and feeling their best.""]","{""Brand"":""Maison Sunny"",""Material"":""100% Cotton"",""Sizes"":""0-3m, 6-12m, 12-18m, 18-24m"",""Color"":""Floral Print"",""Care Instructions"":""Machine washable"",""Item Weight"":""N/A"",""Product Dimensions"":""N/A""}"
