"id","meta_title","url","meta_description","product_description","key_features","specifications"
"7559145390269","Maison Sunny Ahoy Little Sailor Baby Romper | 100% Cotton | Handmade in Sri Lanka","https://maisonsunny.com.au/products/ahoy-little-sailor-baby-romper","Shop the Maison Sunny Ahoy Little Sailor Baby Romper. Made with 100% cotton, this romper is handmade for ultimate comfort. Perfect for special occasions or everyday wear. Available in sizes 0-3m, 9-12m, 12-18m, and 18-24m.","The Maison Sunny Ahoy Little Sailor Baby Romper is a cherished keepsake for your little one. This romper is carefully handmade from 100% cotton, ensuring exceptional comfort and softness against delicate skin.  Its classic design makes it perfect for special occasions like birthdays, weddings, and parties, as well as everyday adventures. Each romper is ethically made by skilled artisan women in Colombo, Sri Lanka, and your purchase directly supports their livelihood.  Dress your baby in this beautiful and comfortable romper, knowing that it's made with love and care. This limited edition, small-batch romper is a must-have addition to your baby's wardrobe.","[""Premium 100% Cotton: Crafted from high-quality, soft cotton, this romper provides ultimate comfort for your baby's delicate skin."",""Handmade with Love: Each romper is meticulously handcrafted by skilled artisans in Sri Lanka, ensuring exceptional quality and attention to detail."",""Versatile Design: Perfect for any occasion, from special events to everyday wear, this classic romper is a versatile addition to your baby's wardrobe."",""Ethically Sourced:  Support artisan women in Sri Lanka with your purchase, knowing that each romper is made with fair labor practices."",""Easy Care: Simply turn the garment inside out and machine wash on a cold, gentle cycle. Line dry in the shade for best results.""]","{""Brand"":""Maison Sunny"",""Material"":""100% Cotton"",""Closure Type"":""Button"",""Care Instructions"":""Machine Wash"",""Country of Origin"":""Sri Lanka"",""Sizes"":""0-3m, 9-12m, 12-18m, 18-24m"",""Color"":""White/Blue Collar"",""Weight"":""N/A"",""Dimensions"":""N/A""}"
"7442460999869","Albetta 2nd Birthday Bunny Toy | Soft & Snuggly Plush | Removable Outfit | 32cm Tall","https://maisonsunny.com.au/products/2nd-year-birthday-bunny-toy","Celebrate your little one's 2nd birthday with this adorable Albetta bunny toy. Made with soft, snuggly fabric and featuring a hand-crocheted '2' and removable organic towelling bottoms. Perfect for cuddles and imaginative play.","Make your child's 2nd birthday extra special with the Albetta 2nd Birthday Bunny Toy. This charming plush bunny is crafted from a luxuriously soft and snuggly fabric, ensuring endless cuddles. Its top features a lovingly hand-crocheted number '2,' adding a unique, personalized touch. The bunny also sports cute, matching organic towelling bottoms that are fully removable, allowing for imaginative play and dressing-up fun. Standing at 32cm tall, this bunny is the perfect size for little hands to hold and hug. It's more than just a toy; it's a keepsake that will be treasured for years to come, commemorating a precious milestone in your child's life. Give the gift of snuggles and smiles with this delightful birthday bunny.","[""Celebrate in style: Mark your little one's 2nd birthday with this adorable and unique Albetta bunny toy, a keepsake they'll cherish."",""Super soft and snuggly: Made from a premium soft fabric, this bunny is perfect for cuddling and comforting your child."",""Hand-crocheted detail: The bunny's top features a hand-crocheted '2', adding a touch of personalized charm."",""Removable outfit: The cute organic towelling bottoms are fully removable, encouraging imaginative play and dressing-up activities."",""Perfect size for little ones: Standing at 32cm tall, this bunny is easy for small hands to grasp and carry, making it an ideal companion for playtime and bedtime.""]","{""Brand"":""Albetta"",""Material"":""Soft plush fabric, organic towelling"",""Height"":""32 cm"",""Weight"":""N/A"",""Width"":""N/A"",""Depth"":""N/A""}"
"7442448318653","Albetta Crochet Bee Bark Towelling Babygro Romper | Organic Cotton | 0-3m, 3-6m, 6-12m","https://maisonsunny.com.au/products/crochet-bee-bark-towelling-babygro-romper","Adorable hand-crocheted bee motif baby romper made from 100% organic toweling cotton. Super soft and comfortable for delicate skin. Machine washable. Available in sizes 0-3m, 3-6m, and 6-12m.","Introducing the Albetta Crochet Bee Bark Towelling Babygro Romper, a charming addition to your little one's wardrobe. This adorable romper features a meticulously hand-crocheted bee motif on a warm autumn brown background, adding a touch of whimsy to their everyday wear. Crafted from 100% GOTS certified organic toweling cotton, this babygro offers exceptional softness and comfort against delicate skin. The absorbent and breathable nature of the fabric makes it perfect for all-day wear, keeping your baby cozy and dry. The modern design and sustainable sourcing of the organic cotton reflect Albetta's commitment to quality and eco-consciousness. This romper is easy to care for, simply machine wash at 30°C. Choose from sizes 0-3m, 3-6m, and 6-12m to find the perfect fit for your growing baby. Give your little one the gift of comfort and style with the Albetta Crochet Bee Bark Towelling Babygro Romper.","[""Hand-Crocheted Bee Motif: This adorable romper features a meticulously hand-crocheted bee, adding a touch of charm and personality to your baby's outfit."",""100% Organic Cotton: Made from GOTS certified organic toweling cotton, this babygro offers exceptional softness and is gentle against delicate skin, reducing the risk of irritation."",""Superior Comfort: The absorbent and breathable organic cotton ensures your baby stays comfortable and dry throughout the day, perfect for playtime or naptime."",""Sustainable and Eco-Friendly: Made with sustainably sourced organic cotton, this romper is a responsible choice for environmentally conscious parents."",""Easy Care: Machine washable at 30°C for easy and convenient cleaning, allowing you to spend more time enjoying precious moments with your little one.""]","{""Brand"":""Albetta"",""Material"":""100% Organic Cotton"",""Care Instructions"":""Machine washable at 30°C"",""Sizes"":""0-3 months, 3-6 months, 6-12 months"",""Color"":""Autumn Brown"",""Item Weight"":""N/A"",""Product Dimensions"":""N/A""}"
"7442451529917","Albetta Crochet Bunny Rattle Toy | Hand-Crocheted Baby Gift","https://maisonsunny.com.au/products/crochet-bunny-rattle-toy","The Albetta Crochet Bunny Rattle Toy is a beautifully hand-crocheted toy made from top-quality cotton. This adorable bunny rattle with its sweet striped top and floppy ears makes a perfect gift for newborns and coordinates with other Albetta farm collection items.","Introducing the adorable Albetta Crochet Bunny Rattle Toy, a delightful companion for little ones. Hand-crocheted with love from premium cotton, this soft and cuddly bunny is the perfect gift for newborns and infants. Its sweet striped top and charming floppy ears add to its irresistible appeal. The gentle rattle sound stimulates baby's auditory senses and encourages play. This high-quality toy is designed to be cherished for years to come. It also coordinates beautifully with other Albetta items from the farm collection, creating a cohesive and charming nursery theme. Give the gift of comfort and joy with this precious bunny rattle. CE/UK safety tested from birth.","[""Hand-Crocheted Quality: Meticulously crafted from top-quality cotton, this bunny rattle offers exceptional softness and durability, ensuring it can withstand countless cuddles and playtime adventures."",""Soothing Rattle Sound: The gentle rattle inside provides auditory stimulation, capturing baby's attention and encouraging sensory development. The soft rattling sound is calming and comforting."",""Adorable Design: Featuring a sweet striped top and cute floppy ears, this bunny rattle is sure to become a beloved companion for your little one. Its charming design adds a touch of whimsy to any nursery."",""Perfect Baby Gift: This beautifully crafted bunny rattle makes a wonderful and thoughtful gift for newborns, baby showers, or any special occasion. It's a gift that will be treasured for years to come."",""Coordinates with Albetta Farm Collection: This bunny rattle complements other Albetta farm collection items, allowing you to create a coordinated and charming nursery theme.""]","{""Brand"":""Albetta"",""Material"":""100% Cotton, 100% Polyester Filling"",""Height"":""15 cm"",""Safety Certification"":""CE/UK tested - Safe from birth""}"
"7442450219197","Albetta Crochet Croco Casey Babygro Romper | 100% Organic Cotton | Baby Romper","https://maisonsunny.com.au/products/crochet-croco-casey-babygro-romper","Adorable hand-crocheted crocodile baby romper by Albetta. Made with 100% organic cotton, this sunshine yellow and white striped romper is soft, comfortable, and perfect for your little one. Machine washable.","The Albetta Crochet Croco Casey Babygro Romper is a must-have for your little one's wardrobe. This adorable romper features a charming hand-crocheted crocodile design, adding a touch of whimsy to their everyday wear. Crafted from 100% organic cotton, it's gentle on delicate skin and ensures maximum comfort. The cheerful sunshine yellow and white stripe design adds a pop of brightness to any outfit. This romper is not only stylish but also practical, as it's machine washable for easy care. Perfect for playtime or special occasions, the Albetta Crochet Croco Casey Babygro Romper is a delightful addition to any baby's collection. This babygro combines traditional handicraft methods with a modern style, resulting in a truly comfortable and delicate fit. It has been a best-seller in the Albetta wild animals collection. Pair it with the matching Albetta Casey Croco Rattle (sold separately) for a complete look.","[""ADORABLE CROCHET DESIGN: Features a charming hand-crocheted crocodile, adding a unique touch to your baby's outfit."",""100% ORGANIC COTTON: Made with soft, breathable, and gentle organic cotton, perfect for sensitive skin."",""SUNSHINE YELLOW & WHITE STRIPE: Cheerful and gender-neutral design, suitable for both baby boys and girls."",""COMFORTABLE & DELICATE FIT: Combines traditional handicraft methods with a modern style for a comfortable and delicate fit."",""EASY CARE: Machine washable at 30°C for convenient cleaning.""]","{""Brand"":""Albetta"",""Material"":""100% Organic Cotton"",""Care Instructions"":""Machine washable at 30°C"",""Sizes"":""0-3 m, 3-6 m, 6-12 m"",""Item Weight"":""N/A"",""Product Dimensions"":""N/A""}"
"7442460508349","Albetta Crochet Croco Casey Rattle Toy | Baby Rattle | Soft Crochet Toy | Newborn Gift","https://maisonsunny.com.au/products/crochet-croco-casey-rattle-toy","The Albetta Crochet Croco Casey Rattle Toy is a handmade, super soft jungle green crocodile rattle. Perfect for newborns, this tactile toy provides hours of fun and helps develop baby's sense of touch. Made with 100% cotton thread and polyester filling. CE/UK safety tested.","Introduce your little one to the adorable Albetta Crochet Croco Casey Rattle Toy! This charming handmade crocodile rattle is the perfect companion for newborns and infants. Crafted with love and care, Casey the Croc features a vibrant jungle green hue, a friendly smile, rosy cheeks, and engaging 3D crochet spots and spines. Made from super soft 100% cotton thread and filled with 100% polyester fiber, this rattle is gentle against delicate skin while providing a stimulating tactile experience. The easy-to-grab body is perfectly sized for little hands, encouraging grasping and exploration. Casey the Croc not only provides hours of entertainment but also helps to develop your baby's sense of touch and coordination. This delightful rattle is CE/UK safety tested, ensuring it meets the highest safety standards for your peace of mind. Give the gift of snuggles and smiles with the Albetta Crochet Croco Casey Rattle Toy. It's a cherished keepsake that will be treasured for years to come. Length: 20 cm.","[""Handmade Crochet Rattle: This adorable crocodile rattle is lovingly handcrafted with intricate crochet details, making it a unique and special gift for newborns."",""Super Soft and Tactile: Made from 100% cotton thread and filled with 100% polyester fiber, this rattle is incredibly soft and gentle against baby's delicate skin, providing a soothing and comforting tactile experience."",""Engaging Design: Featuring a cheerful jungle green crocodile with 3D crochet spots, spines, rosy cheeks, and a friendly smile, this rattle captures baby's attention and encourages imaginative play."",""Developmental Toy: The easy-to-grab body is perfectly sized for little hands, promoting grasping, hand-eye coordination, and sensory exploration. The gentle rattling sound stimulates auditory development."",""Safe and Durable: CE/UK safety tested, this rattle is made from high-quality materials and is free from harmful substances, ensuring it's safe for even the youngest babies. Built to withstand everyday play, it's a durable and long-lasting toy.""]","{""Brand"":""Albetta"",""Material"":""100% Cotton Thread, 100% Polyester Fiber Filling"",""Length"":""20 cm"",""Safety Certification"":""CE/UK Tested""}"
"7442448613565","Albetta Crochet Estelle Eli Babygro Romper | Organic Cotton Baby Romper | 0-3m, 3-6m, 6-12m","https://maisonsunny.com.au/products/crochet-estelle-eli-babygro-romper","Adorable Albetta Estelle Eli Babygro Romper made with deluxe pink striped organic cotton. Features a hand-made elephant motif and grey marl trims. Perfect new baby gift.","The Albetta Crochet Estelle Eli Babygro Romper is the perfect gift for your little one. Crafted from deluxe pink striped organic cotton, this romper is gentle on delicate skin and features an intricately hand-made elephant motif, adding a touch of whimsy to your baby's wardrobe. The distinctive grey marl trims at the neck and cuffs provide a stylish contrast and signature Albetta detail. This gorgeous and modern design, made from the softest sustainable cotton, ensures both comfort and style for your precious little one. Machine washable at 30°C for easy care. Matching cuddle toys are also available. Ideal for newborns and babies up to 12 months. Choose from sizes 0-3m, 3-6m, and 6-12m.","[""Premium Organic Cotton: Made from 100% deluxe pink striped organic cotton, this babygro is gentle on your baby's delicate skin and environmentally friendly."",""Hand-Crafted Elephant Motif: Features an intricately hand-made elephant motif, adding a unique and charming touch to this adorable romper."",""Signature Albetta Detail: Distinctive grey marl trims at the neck and cuffs provide a stylish contrast and mark the romper with Albetta's signature quality."",""Soft and Sustainable: Crafted from the softest sustainable cotton, this babygro ensures ultimate comfort for your little one while being kind to the planet."",""Easy Care: Machine washable at 30°C, making it easy to keep this romper clean and fresh for your baby.""]","{""Brand"":""Albetta"",""Material"":""100% Organic Cotton"",""Care Instructions"":""Machine washable at 30°C"",""Sizes"":""0-3 months, 3-6 months, 6-12 months"",""Color"":""Pink Stripe with Grey Marl Trim"",""Product Dimensions"":""N/A"",""Product Weight"":""N/A""}"
"7442448842941","Albetta Crochet Leo Lion Grey Stripe Babygro Romper | Soft Organic Cotton | 6-12 Months","https://maisonsunny.com.au/products/crochet-leo-lion-grey-stripe-babygro-romper","Adorable Albetta Leo lion babygro, perfect for newborns. Made from soft grey and white striped organic cotton with a hand-crocheted lion motif. Cozy and comfortable for bedtime cuddles.","This adorable Albetta Leo lion babygro is the perfect gift for a new arrival! Reworking Albetta's iconic crochet lion motif, this babygro is crafted from the softest grey and white striped 100% organic cotton. It features marl-trimmed cuffs and neckline for a touch of style. The highlight is the gorgeous hand-crocheted lion on the front, complete with a fluffy mane and sleepy eyes, guaranteed to bring a smile to everyone's face. Get ready for cozy cuddles at bedtime! This babygro is machine washable at 30°C for easy care. Matching rattle and cuddle toys are also available to complete the set. Perfect for newborns and babies aged 6-12 months.","[""Adorable hand-crocheted lion design: Features a charming hand-crocheted lion with a fluffy mane and sleepy eyes, adding a touch of whimsy to this babygro."",""Soft and cozy organic cotton: Made from 100% organic cotton, this babygro is gentle against delicate skin and ensures maximum comfort for your little one."",""Stylish grey and white stripes: The classic grey and white stripes add a touch of timeless style to this babygro, making it a perfect outfit for any occasion."",""Marl-trimmed cuffs and neckline: The marl-trimmed cuffs and neckline provide a snug fit and add a touch of detail to the overall design."",""Easy care: Machine washable at 30°C, this babygro is easy to care for, allowing you to spend more time cuddling your little one.""]","{""Brand"":""Albetta"",""Material"":""100% Organic Cotton"",""Care Instructions"":""Machine washable at 30°C"",""Size"":""6-12 Months"",""Color"":""Grey Stripe"",""Pattern"":""Striped with Crochet Lion"",""Closure Type"":""Snap"",""Department"":""Baby"",""Product Type"":""Babygrow/Romper""}"
"7442455855293","Albetta Crochet Leo Lion Stick Rattle | Baby Shower Gift | Soft Cotton | Easy Grip","https://maisonsunny.com.au/products/crochet-leo-lion-stick-rattle","This hand-crocheted Albetta lion rattle is a perfect baby shower gift. Made from soft cotton, its stick shape makes it easy for little hands to grip. Gender-neutral design.","This beautifully crafted Albetta lion rattle is hand-crocheted from top-quality cotton, making it a wonderful unisex baby shower gift. Its soft cotton mane and friendly face will charm any little one. The stick shape provides an easy grip for small hands, encouraging sensory exploration and play.  It coordinates perfectly with other items from our crochet lion range, including the lion comforter and lion babygro, allowing you to create a cohesive and adorable nursery theme. This rattle is not only a delightful toy but also a beautiful keepsake that will be treasured for years to come. Made with 100% cotton and 100% polyester stuffing, it is soft, durable, and safe for your baby. Height: 14 cm.","[""Hand-Crocheted Quality: Meticulously crafted from premium cotton, this lion rattle offers exceptional softness and durability for gentle play."",""Perfect Baby Shower Gift: This charming lion rattle is a thoughtful and unique present for newborns, infants, and toddlers, suitable for both boys and girls."",""Easy-Grip Design: The stick shape is perfectly sized for little hands to grasp and hold, promoting fine motor skills development."",""Soft & Soothing: The gentle rattling sound and soft cotton mane provide a calming and comforting sensory experience for babies."",""Adorable Lion Design: The friendly lion face with its soft mane adds a touch of whimsy and charm to any nursery or play area.""]","{""Brand"":""Albetta"",""Material"":""100% Cotton, 100% Polyester stuffing"",""Height"":""14 cm"",""Weight"":""N/A"",""Width"":""N/A"",""Depth"":""N/A""}"
"7442451431613","Albetta Crochet Ollie Owl Rattle Toy | Baby Shower Gift | Hand-Crocheted | Cotton | Soft Toy","https://maisonsunny.com.au/products/crochet-owl-rattle-toy","Adorable hand-crocheted Ollie Owl rattle toy by Albetta. Made with 100% cotton, this soft toy is perfect for newborns and makes a delightful baby shower gift. CE/UK safety tested.","Introducing the charming Albetta Crochet Ollie Owl Rattle Toy! This irresistibly cute rattle is lovingly hand-crocheted with intricate details, featuring pointy ears and a sweet face that will capture your baby's attention. Crafted from 100% cotton thread and filled with 100% polyester fiber, it's incredibly soft and gentle against delicate skin, making it ideal for newborns and up. The gentle rattling sound stimulates auditory development and provides endless entertainment for little ones. This adorable owl rattle is not only a source of comfort and fun but also a beautiful keepsake that will be treasured for years to come. Give the gift of snuggles and smiles with the Albetta Crochet Ollie Owl Rattle Toy – a perfect present for baby showers, birthdays, or any special occasion. CE/UK tested for safety from birth. Height: 11 cm.","[""Hand-Crocheted Delight: This adorable owl rattle is meticulously hand-crocheted with intricate details, making it a unique and cherished gift."",""Soft & Gentle: Made from 100% cotton thread and filled with 100% polyester fiber, this rattle is incredibly soft and perfect for cuddling."",""Soothing Rattle: The gentle rattling sound stimulates your baby's auditory senses and provides hours of entertainment."",""Safe for Newborns: CE/UK safety tested, ensuring it's suitable for babies from birth."",""Perfect Baby Gift: This charming owl rattle is an ideal present for baby showers, birthdays, or any occasion celebrating a little one.""]","{""Brand"":""Albetta"",""Material"":""100% Cotton Thread, 100% Polyester Fiber Filling"",""Height"":""11 cm"",""Safety Certification"":""CE/UK Tested""}"
"7442448711869","Albetta Crochet Owl Stripe Babygro Romper | Organic Cotton Baby Grow","https://maisonsunny.com.au/products/crochet-owl-stripe-babygro-romper","Adorable pink stripe organic cotton babygro with a hand-crocheted owl motif. Ethically sourced and machine washable. Perfect gift for little ones!","The Albetta Crochet Ollie Owl Babygro is the perfect gift for your little one. This adorable baby grow is made from soft, ethically sourced, pink striped organic cotton and features a meticulously hand-crocheted owl motif. The gorgeous and modern design makes this babygro a must-have for your baby's wardrobe. It's machine washable at 30°C for easy care. Pair it with the matching Crochet Owl Rattle (sold separately) for a complete gift set.","[""Hand-Crocheted Owl Design: Features a charming, meticulously hand-crocheted owl motif, adding a touch of whimsy to this adorable babygro."",""Premium Organic Cotton: Made from 100% GOTS certified organic cotton, ensuring a soft and gentle touch against your baby's delicate skin."",""Pink Stripe Pattern: The playful pink stripe pattern adds a touch of style and cheerfulness to this baby grow."",""Ethically Sourced: Crafted with ethically sourced organic cotton, reflecting a commitment to sustainable and responsible practices."",""Easy Care: Machine washable at 30°C for convenient cleaning and everyday wear.""]","{""Brand"":""Albetta"",""Material"":""100% Organic Cotton"",""Care Instructions"":""Machine washable at 30°C"",""Color"":""Pink Stripe"",""Pattern"":""Striped with Crochet Owl"",""Sizes"":""0-3 m, 3-6 m, 6-12 m"",""Dimensions"":""N/A"",""Weight"":""N/A""}"
"7442450153661","Albetta Crochet Panda Babygro Romper | 0-3m | 100% Organic Cotton | Baby Romper","https://maisonsunny.com.au/products/crochet-panda-babygro-romper","Adorable Albetta Crochet Panda Babygro Romper made with 100% organic cotton. This terracotta striped romper features a hand-crocheted panda, perfect for newborns and babies 0-3 months. Machine washable.","The Albetta Crochet Panda Babygro Romper is the perfect gift for your little one. This adorable romper is made from deluxe terracotta striped 100% organic cotton and features a meticulously hand-crocheted panda motif. Cream trims line the neck and cuffs, adding a signature Albetta detail. This comfortable and modern design is made from sustainably sourced BCI cotton. Machine washable at 30°C.

This babygro is designed for newborns and babies aged 0-3 months. Pair it with the matching Crochet Panda Rattle (sold separately) for a complete panda-themed outfit. This romper makes a wonderful gift for baby showers, birthdays, or any special occasion.","[""ADORABLE PANDA DESIGN: Features a meticulously hand-crocheted panda motif on a terracotta striped background, making this babygro a truly unique and charming outfit for your little one."",""PREMIUM ORGANIC COTTON: Crafted from 100% organic cotton, this romper is gentle on delicate skin, ensuring maximum comfort and breathability for your baby."",""SUSTAINABLY SOURCED: Made with BCI cotton, supporting better cotton farming practices that are environmentally friendly and socially responsible."",""SIGNATURE ALBETTA DETAIL: Cream trims around the neck and cuffs add a touch of elegance and sophistication, making this babygro a stylish choice for your baby."",""EASY CARE: Machine washable at 30°C for convenient cleaning and maintenance, allowing you to spend more time enjoying precious moments with your baby.""]","{""Brand"":""Albetta"",""Material"":""100% Organic Cotton"",""Care Instructions"":""Machine washable at 30°C"",""Size"":""0-3 months"",""Color"":""Terracotta Striped"",""Item Weight"":""N/A"",""Product Dimensions"":""N/A""}"
